,id,address
274,579e47d4498ee8329b3cd1a9,"الجموح, حي النخيل, Al Nakheel District حي النخيل, الدرعية, منطقة الرياض, 12393 4057, Saudi Arabia / السعودية"
275,56585c78498e1e236fd285d9,"الحملان, Al Nafil District حي النقل, Stadtbezirk asch-Schamāl, الدرعية, منطقة الرياض, 13311, Saudi Arabia / السعودية"
276,526e246511d2fa12163d97fd,"03: College of Administrative Science, طريق تركي الأول بن عبدالعزيز آل سعود, المحمدية, Al Muhammadiyah District حي المحمدية, الدرعية, منطقة الرياض, 12371, Saudi Arabia / السعودية"
277,4f3eb3d8e4b05870169889f9,"حبان بن عبدالله, الملك فهد, King Fahd District حي الملك فهد, الرياض, منطقة الرياض, 12272, Saudi Arabia / السعودية"
278,5bb79db93731ee002cc835cc,"عبدالملك المارني, Hittin District حي حطين, Stadtbezirk asch-Schamāl, الدرعية, منطقة الرياض, 12393 4057, Saudi Arabia / السعودية"
279,4fcddfdbe4b032142f70f9f4,"طريق المدينة المنورة, Zahrat al Badiah District ظهرة البديعة, Namar Municipality, العريجاء, منطقة الرياض, 12783-8458, Saudi Arabia / السعودية"
280,507662c0e4b0d31633065fd4,"الرضاء, Al Olaya District حي العليا, الرياض, منطقة الرياض, 12211, Saudi Arabia / السعودية"
281,4f15c269e4b03f4c03fb50e0,"IKEA, طريق الدائري الشرقي, Al Faruq District حي الفاروق, الرياض, منطقة الرياض, 12883, Saudi Arabia / السعودية"
282,5be4748dc66666002cc756f5,"عرقة, الدرعية, منطقة الرياض, 11614, Saudi Arabia / السعودية"
283,5ae3605e89ad46002495ddc0,"McDonalds, الأمير بندر بن عبدالعزيز, Al Nahdhah District حي النهضة, الرياض, منطقة الرياض, 13211, Saudi Arabia / السعودية"
284,5049f375e4b0a7a32d97e59b,"Al Masif District حي المصيف, الرياض, منطقة الرياض, 13311, Saudi Arabia / السعودية"
285,53b85fdb498e531e3fa48c0a,"عبدالرحمن الغافقي, الملك فيصل, King Faisal District حي الملك فيصل, الرياض, منطقة الرياض, 13211, Saudi Arabia / السعودية"
286,5e4ee68d8cec040008450dfe,"الحسن بن علي, حي الروضة, الرياض, منطقة الرياض, 13211, Saudi Arabia / السعودية"
287,5bec4a4bb9ac3816766c1b74,"شارع أنس بن مالك, الياسمين, Al Yasmin District, Stadtbezirk asch-Schamāl, الرياض, منطقة الرياض, 7069, Saudi Arabia / السعودية"
288,51ee9d92498e3f88025c6cc7,"الصفاة, Al Izdihar District حي الازدهار, الرياض, منطقة الرياض, 12483, Saudi Arabia / السعودية"
289,4beb15ff61aca593f2968400,"Hijrat Laban, الرياض, منطقة الرياض, 9078, Saudi Arabia / السعودية"
290,56373b37498e640933443219,"الدرعية, منطقة الرياض, 11671, Saudi Arabia / السعودية"
291,51e3f750498ea3e167750da3,"حفصة بنت عمر, Al Andalus District حي الاندلس, الرياض, منطقة الرياض, 13211, Saudi Arabia / السعودية"
292,53e28362498e76aefc18f92a,"عثمان بن عفان, مغرزات, Al-Mugharzat District حي المغرزات, الرياض, منطقة الرياض, 12483, Saudi Arabia / السعودية"
293,4ef5c2d4a69dea74f9563694,"الرياض, منطقة الرياض, Saudi Arabia / السعودية"
294,50a79752e4b089c95094529e,"الأمير سعد بن عبدالرحمن الأول, As Saadah District حي السعادة, As Sali Municipality, الرياض, منطقة الرياض, 12883, Saudi Arabia / السعودية"
295,5d6163de2c61ca0008da3b41,"صلاح الدين, Salah ad Din District حي صلاح الدين, الرياض, منطقة الرياض, 12435, Saudi Arabia / السعودية"
296,5a200b0442d8c23429e922f2,"Prince Turkey Bin Abdul Aziz Al thani, Almuruj District حي المروج, الدرعية, منطقة الرياض, 12388, Saudi Arabia / السعودية"
297,5cf96a4bbfc6d0002cad6eb3,"The Lamb Shack, أبي بن معاذ الأنصاري, Al Rabiea District حي الربيع, Stadtbezirk asch-Schamāl, الدرعية, منطقة الرياض, 7069, Saudi Arabia / السعودية"
298,50c76127e4b00ecf08d27af5,"سالم بن معقل, حي النخيل, Al Nakheel District حي النخيل, الدرعية, منطقة الرياض, 12393 4057, Saudi Arabia / السعودية"
299,4f354bdbe4b0debe1efc0671,"أحمد بن محمد السديري, القدس, Al Qouds District حي القدس, الرياض, منطقة الرياض, 13216, Saudi Arabia / السعودية"
300,5d938882bf8cf700089e5b08,"الأمير سعد بن عبدالرحمن الأول, Al Rawabi District حي الروابي, Al Naseem Municipality, الرياض, منطقة الرياض, 12883, Saudi Arabia / السعودية"
301,597dc73975eee4422d945061,"Taiba, Zahrat Laban District حي ظهرة لبن, الرياض, منطقة الرياض, 12564-9078, Saudi Arabia / السعودية"
302,5d79e2f6cd95ad000871260f,"شارع الأمير نايف بن عبدالعزيز, الملك فهد, King Fahd District حي الملك فهد, الدرعية, منطقة الرياض, 12272, Saudi Arabia / السعودية"
303,5d7e8ebea518560007f6f36f,"As-Sahabh, اليرموك, الرياض, منطقة الرياض, 62800, Saudi Arabia / السعودية"
304,5db0aea4c25ad30008bd9f1e,"طريق الأمير مشعل بن عبد العزيز, عرقة, الدرعية, منطقة الرياض, 11614, Saudi Arabia / السعودية"
305,5b69d4fa67f62b0039681e5e,"الكناني, As Suwaydi al Gharbi District حي السويدي الغربي, الرياض, منطقة الرياض, 12783-8458, Saudi Arabia / السعودية"
306,5df27b728de7b40008c0e44d,"ظهرة لبن, الدرعية, منطقة الرياض, 12564-9078, Saudi Arabia / السعودية"
307,5d216a63ac5dfc002fa4e29c,"الملز, Al Malaz District حي الملز, الرياض, منطقة الرياض, 12836, Saudi Arabia / السعودية"
308,5da7714b374b2700074f8e77,"عبدالغني بن سرور, Zahrat al Badiah District ظهرة البديعة, الرياض, منطقة الرياض, 12783-8458, Saudi Arabia / السعودية"
309,5c764267250cab002ca6594c,"حي الغروب  Sunset district, Tuwayq District حي طويق, Namar Municipality, الرياض, منطقة الرياض, Saudi Arabia / السعودية"
310,5e2c76e6e2a61200080f9a17,"أبي سعيد الخدري, الملك فيصل, King Faisal District حي الملك فيصل, الرياض, منطقة الرياض, 62800, Saudi Arabia / السعودية"
311,5e79052056ca8b0008832e9f,"الناقورة, Namar District حي نمار, Namar Municipality, الرياض, منطقة الرياض, 14713, Saudi Arabia / السعودية"
312,5e830c8934e8520008680568,"شارع الحبيل, Al Malga District حي الملقا, Stadtbezirk asch-Schamāl, الدرعية, منطقة الرياض, 13515 - 4372, Saudi Arabia / السعودية"
313,5cd1eebe1acf11002c79eaa0,"Al Mutamarat District حي المؤتمرات, الرياض, منطقة الرياض, 11454, Saudi Arabia / السعودية"
314,5c87ff6b286fda002c234bf6,"Al-Khaleefa Al Mamoun, Badr District حي بدر, Al Shifa Municipality, الرياض, منطقة الرياض, 14713, Saudi Arabia / السعودية"
315,5b65ebc1492814002c2ea8a1,"مارينا مول, طريق الملك عبدالعزيز, الملك فهد, King Fahd District حي الملك فهد, الدرعية, منطقة الرياض, 12273, Saudi Arabia / السعودية"
316,5e347d4b0a924d0008d30741,"ابن الجوزي, Zahrat al Badiah District ظهرة البديعة, الرياض, منطقة الرياض, 12783-8458, Saudi Arabia / السعودية"
317,5c13ae72c9f907002cc70175,"Hamza Bin Abdulmuttallib, Al Hazm District حي الحزم, Namar Municipality, الرياض, منطقة الرياض, 14713, Saudi Arabia / السعودية"
318,5e1cb1064892170009dc6890,"العجير السلولي, Al Olaya District حي العليا, Municipality Al Madhar المعذر, منطقة الرياض, 12211, Saudi Arabia / السعودية"
319,5cd2107fdd12f8002cf11cd1,"الحارث بن عبدالله, District حي النظيم, Al Naseem Municipality, الرياض, منطقة الرياض, 11426, Saudi Arabia / السعودية"
320,5b1334004f0e58002c88ff59,"حي الخليج, الرياض, منطقة الرياض, 62800, Saudi Arabia / السعودية"
321,5cae2b9cf8cbd4002c2fd10f,"الرياض, منطقة الرياض, 11671, Saudi Arabia / السعودية"
322,5c876a1c628c83002c9cac0a,"وادي ملحة, Al-Qadisiyah District حي القادسية, الرياض, منطقة الرياض, 62800, Saudi Arabia / السعودية"
323,5d7f89f0f290e100082cb166,"سماحة الشيخ عبدالعزيز بن باز, Al Badiah District حي البديعة, الرياض, منطقة الرياض, 19678, Saudi Arabia / السعودية"
324,5d56a50313ed880008129e91,"الهواري, الملز, Al Malaz District حي الملز, الرياض, منطقة الرياض, 12836, Saudi Arabia / السعودية"
325,59287ac5cad1b6573077cd6d,"Riyadh Bank, طريق عثمان بن عفان, Al Nada District حي الندى, Stadtbezirk asch-Schamāl, الرياض, منطقة الرياض, 13314 - 4017, Saudi Arabia / السعودية"
326,5e29f54febe2870007ce133e,"طريق الملك سلمان, Al Malga District حي الملقا, Stadtbezirk asch-Schamāl, الدرعية, منطقة الرياض, 13522, Saudi Arabia / السعودية"
327,5144afc6e4b016fae368a1f7,"طريق الملك عبدالله, Al Raid District حي الرائد, الدرعية, منطقة الرياض, 12371, Saudi Arabia / السعودية"
328,52a5a4ca11d2df415770ca9c,"Compund, الطريق الدائري الشمالي, Al Falah District حي الفلاح, Stadtbezirk asch-Schamāl, الرياض, منطقة الرياض, 13314 - 4017, Saudi Arabia / السعودية"
329,50af5c5fe4b09d9e06d66674,"عبدالرحمن الغافقي, الملك فيصل, King Faisal District حي الملك فيصل, الرياض, منطقة الرياض, 13211, Saudi Arabia / السعودية"
330,596fb54defa82a5693a3fd59,"الأمير محمد بن سلمان بن عبدالعزيز, Al Wadi District حي الوادي, Stadtbezirk asch-Schamāl, الرياض, منطقة الرياض, 13314 - 4017, Saudi Arabia / السعودية"
331,5b3e32582a7ab600392f63f8,"الإمام عبدالله بن سعود بن عبدالعزيز, اليرموك, الرياض, منطقة الرياض, 62800, Saudi Arabia / السعودية"
332,5a150629b546182d6460d399,"طريق العليا العام, Al Olaya District حي العليا, الرياض, منطقة الرياض, 12214, Saudi Arabia / السعودية"
333,58d9ed9afda3d8151845a414,"العقارية الثانية, شارع موسي بن نصير, Al Olaya District حي العليا, الرياض, منطقة الرياض, 12213, Saudi Arabia / السعودية"
334,513dce36e4b0a2c59edb37c3,"أبي الفداء إسماعيل, As Sulaymaniyah District حي السليمانية, الرياض, منطقة الرياض, 12213, Saudi Arabia / السعودية"
335,53510b98498e9a6ceaccf45e,"ابن هميم, As Sahafah District حي الصحافة, Stadtbezirk asch-Schamāl, الدرعية, منطقة الرياض, 7069, Saudi Arabia / السعودية"
336,527e338f11d26b82a5c74570,"مكة المكرمة, Al Zahraa District حي الزهراء, المالز, منطقة الرياض, 11411, Saudi Arabia / السعودية"
337,535f73ed498ef2811628fa22,"Forum & Computer Center, road_12, King Saud University District, الدرعية, منطقة الرياض, 145111, Saudi Arabia / السعودية"
338,516538d2e4b038351341f64d,"فندق مركور, شهيد الدين ثم الوطن عبدالجليل شارع العتيبي, Ghirnatah District حي غرناطة, الرياض, منطقة الرياض, 13241, Saudi Arabia / السعودية"
339,58a44d479c954835cced139e,"74/75, عبدالعزيز بن محمد بن عبدالكريم المنقور, Ghirnatah District حي غرناطة, الرياض, منطقة الرياض, 13216, Saudi Arabia / السعودية"
340,51137688e4b037b4be64665d,"الحنكة, Al Raid District حي الرائد, الدرعية, منطقة الرياض, 12371, Saudi Arabia / السعودية"
341,598772e72ebb34734fa473a0,"الأمير محمد بن عبدالعزيز, Al-Ma'athar Al-Shimali District حي المعذر الشمالي, Municipality Al Madhar المعذر, منطقة الرياض, 12213, Saudi Arabia / السعودية"
342,5a1305f159c4235dc1f68ccd,"الدائري الشمالي, حي النخيل, Al Nakheel District حي النخيل, الدرعية, منطقة الرياض, 12393 4057, Saudi Arabia / السعودية"
343,57107d1f498eac8ccb437d3a,"King Abdul Aziz Road, Al Rabiea District حي الربيع, Stadtbezirk asch-Schamāl, الدرعية, منطقة الرياض, 7069, Saudi Arabia / السعودية"
344,594b89e0a2a6ce5a03576a4e,"الملك عبدالله, القدس, Al Qouds District حي القدس, الرياض, منطقة الرياض, 13216, Saudi Arabia / السعودية"
345,4db599fc81543d71da5b8e83,"Centeria Mall, طريق العليا العام, Al Olaya District حي العليا, الرياض, منطقة الرياض, 12213, Saudi Arabia / السعودية"
346,5251ace8498efe8ce6f47945,"عرفات, Ad Dar Al Baida حي الدار البيضاء, Al Aziziyah Municipality, الرياض, منطقة الرياض, 54033, Saudi Arabia / السعودية"
347,51c796cd498e0ac964e6628e,"برج المملكة, طريق الملك فهد, Al Olaya District حي العليا, الرياض, منطقة الرياض, 12214, Saudi Arabia / السعودية"
348,5079bcf6e4b0602b62ba45cc,"وادي الصمان, Al Olaya District حي العليا, الرياض, منطقة الرياض, 12211, Saudi Arabia / السعودية"
349,575c8b98498e3d47d4bc73c5,"Mayrig, الأمير محمد بن عبدالعزيز, Al-Ma'athar Al-Shimali District حي المعذر الشمالي, Municipality Al Madhar المعذر, منطقة الرياض, 12213, Saudi Arabia / السعودية"
350,582de1771094cb749f6a192d,"رقم 70, Al Olaya District حي العليا, الرياض, منطقة الرياض, 12214, Saudi Arabia / السعودية"
351,55369f4f498e8d218f2b1a53,"الأمير عبدالإله بن عبدالعزيز, النخيل, Al Nakheel District حي النخيل, الدرعية, منطقة الرياض, 12388, Saudi Arabia / السعودية"
352,53637086498ebebcd5bbc044,"برج رافال كمبينسي, طريق الملك فهد, As Sahafah District حي الصحافة, Stadtbezirk asch-Schamāl, الدرعية, منطقة الرياض, 13515 - 4372, Saudi Arabia / السعودية"
353,52f9dbf8498ec1f2b0d17360,"رقم 84, Al Olaya District حي العليا, الرياض, منطقة الرياض, 12214, Saudi Arabia / السعودية"
354,5e536de1b03c400008e5ae84,"البادية, Al Yasmin District, Stadtbezirk asch-Schamāl, الرياض, منطقة الرياض, 7069, Saudi Arabia / السعودية"
355,533bb23a498e94f7b2c94f87,"مصدق الصلحي, Al Olaya District حي العليا, الرياض, منطقة الرياض, 12213, Saudi Arabia / السعودية"
356,57ac4cef498ea2d3ce3f6fe3,"طريق العروبة, District of Umm Al-Hamam (West) حي ام الحمام الغربي, الرياض, منطقة الرياض, 12334-2723, Saudi Arabia / السعودية"
357,5d47c3812442890007d4d903,"الرياض, منطقة الرياض, 12233, Saudi Arabia / السعودية"
358,5c15ed50135b390039004dfa,"الأمير سعد بن عبدالرحمن الأول, As Saadah District حي السعادة, As Sali Municipality, الرياض, منطقة الرياض, 12883, Saudi Arabia / السعودية"
359,5745fcee498e2b7c87d71a5d,"Al-Mashatal, Al Hazm District حي الحزم, Namar Municipality, الرياض, منطقة الرياض, 14713, Saudi Arabia / السعودية"
360,5ac5a757ca18ea0e44897ef5,"شارع سلمان الفارسي, Al Nahdhah District حي النهضة, الرياض, منطقة الرياض, 62800, Saudi Arabia / السعودية"
361,5dc8f398fe7b760008d70eca,"مستشفى الملك سلمان, عـائشة بنت أبي بكر, Al Urayja al Wusta District حي العريجاء الوسطى, الرياض, منطقة الرياض, 12783-8458, Saudi Arabia / السعودية"
362,598a903275cb8c6e81ff0131,"شارع البيان, Al Fayha District حي الفيحاء, As Sali Municipality, الرياض, منطقة الرياض, 11211, Saudi Arabia / السعودية"
363,52c27563498eaecbf0a23a58,"Kudu, طريق الشفا, Zahrat Laban District حي ظهرة لبن, الرياض, منطقة الرياض, 12564-9078, Saudi Arabia / السعودية"
364,51b3f593498e028dc793d4a4,"العزيزية, Al Aziziyah District حي العزيزية, Al Aziziyah Municipality, الرياض, منطقة الرياض, 54033, Saudi Arabia / السعودية"
365,4eddd12d02d5244e34759e30,"الشيخ عبدالرحمن بن عبداللطيف بن عبدالرحمن, Al Manar, Al Manar District حي المنار, Al Naseem Municipality, النسيم, منطقة الرياض, 11433, Saudi Arabia / السعودية"
366,5122f2e3e4b0255ef50ab9fa,"Kudu, أبو عبيدة عامر بن الجراح, حي الجزيرة, Al Jazirah District حي الجزيرة, As Sali Municipality, الرياض, منطقة الرياض, 11211, Saudi Arabia / السعودية"
367,54587906498e835007465de4,"الملك عبدالله, الجديدة, الدرعية, منطقة الرياض, 13514 - 7741, Saudi Arabia / السعودية"
368,53e77b19498e569365d6bd06,"Milano pizza pasta, شارع أبي الأسود الدؤلي, النسيم الشرقي, Al Naseem District Eastحي النسيم الشرقي, Al Naseem Municipality, النسيم, منطقة الرياض, 11426, Saudi Arabia / السعودية"
369,55f3c970498e38daf825e7f8,"Al Mansurah District حي المنصوره, الرياض, منطقة الرياض, 54033, Saudi Arabia / السعودية"
370,56dbee31498e07b1250f1020,"Al l'Ietidal, صناعية الشفا, Badr District حي بدر, Al Shifa Municipality, الرياض, منطقة الرياض, 14713, Saudi Arabia / السعودية"
371,55696857498e26c0489724f2,"أبي سعيد الخدري, الملك فيصل, King Faisal District حي الملك فيصل, الرياض, منطقة الرياض, 62800, Saudi Arabia / السعودية"
372,55e35eb1498e7d11f352ee9d,"قريش المدني, Ash Shifa District حي الشفا, Al Shifa Municipality, الرياض, منطقة الرياض, 14713, Saudi Arabia / السعودية"
373,56744f41498e8b94bc54960e,"الشيخ حسن بن حسين بن علي, Qurtubah, الرياض, منطقة الرياض, 13244, Saudi Arabia / السعودية"
374,5827ef1c165d973540008aeb,"عثمان بن عفان, Al Falah District حي الفلاح, Stadtbezirk asch-Schamāl, الرياض, منطقة الرياض, 13314 - 4017, Saudi Arabia / السعودية"
375,4c6efe78b3ce224b3c7a6fc6,"شارع عبدالله بن رواحة, As Sulaymaniyah District حي السليمانية, الرياض, منطقة الرياض, 11411, Saudi Arabia / السعودية"
376,4ec1e6ae9a52cce4f47b07f3,"الزبير بن العوام, حي السلام, Al Naseem Municipality, النسيم, منطقة الرياض, 14215, Saudi Arabia / السعودية"
377,4e73ba948998f94a587055f9,"فوال الخرطوم, شارع متعب بن عبدالعزيز, الربوة, Al Rabwah District حي الربوة, الرياض, منطقة الرياض, 12821, Saudi Arabia / السعودية"
378,4e6442b81f6ef7d07b7fcb0a,"Al Masif District حي المصيف, الرياض, منطقة الرياض, 13311, Saudi Arabia / السعودية"
379,500705f2e4b0d9d6f907e628,"البحر الأحمر, Al Wadi District حي الوادي, Stadtbezirk asch-Schamāl, الرياض, منطقة الرياض, 13311, Saudi Arabia / السعودية"
380,51169912e4b0ec510842cbdc,"الزبير بن العوام, حي السلام, Al Naseem Municipality, النسيم, منطقة الرياض, 14215, Saudi Arabia / السعودية"
381,4ecb4d106c2502f6a60730de,"عـائشة بنت أبي بكر, Al Urayja al Wusta District حي العريجاء الوسطى, الرياض, منطقة الرياض, 12783-8458, Saudi Arabia / السعودية"
382,50cb551a498e9af652f80943,"الحمراء, الرياض, منطقة الرياض, 13216, Saudi Arabia / السعودية"
383,5c12af0946e1b6002c9c21e6,"طريق الأمير محمد بن سلمان بن عبدالعزيز, Hittin District حي حطين, Stadtbezirk asch-Schamāl, الدرعية, منطقة الرياض, 13514 - 7741, Saudi Arabia / السعودية"
384,50a46a83e4b0a46f90fc1e98,"Prince Turkey Bin Abdul Aziz Al thani, Almuruj District حي المروج, الدرعية, منطقة الرياض, 12388, Saudi Arabia / السعودية"
385,56e47ac7498ed140df015106,"الثمامة, المونسية, الرياض, منطقة الرياض, 11263, Saudi Arabia / السعودية"
386,4e9fd83582310652a7fb4181,"خالد ابن الوليد, Ghirnatah District حي غرناطة, الرياض, منطقة الرياض, 13216, Saudi Arabia / السعودية"
387,539bfc80498e4bc6856ba08c,"جبل الفاو, As Sahafah District حي الصحافة, Stadtbezirk asch-Schamāl, الدرعية, منطقة الرياض, 7069, Saudi Arabia / السعودية"
388,57f35e91498e9dabc0d700cf,"Qurtubah, الرياض, منطقة الرياض, 13244, Saudi Arabia / السعودية"
389,51a3b9da498e5f4013fe1060,"شارع الأمير نايف بن عبدالعزيز, الملك فهد, King Fahd District حي الملك فهد, الدرعية, منطقة الرياض, 12272, Saudi Arabia / السعودية"
390,4fc51c65e4b0093f0b50b624,"الأمير بندر بن عبدالعزيز, Al Nahdhah District حي النهضة, الرياض, منطقة الرياض, 13211, Saudi Arabia / السعودية"
391,4ed3f0ff5c5c9528fd66203d,"الزبير بن العوام, حي السلام, Al Naseem Municipality, النسيم, منطقة الرياض, 14215, Saudi Arabia / السعودية"
392,5099d973e4b071145aac05ba,"الشيخ حسن بن حسين بن علي, الملك فيصل, King Faisal District حي الملك فيصل, الرياض, منطقة الرياض, 62800, Saudi Arabia / السعودية"
393,50cd72b4e4b05e0e55c77788,"Taiba, Zahrat Laban District حي ظهرة لبن, الرياض, منطقة الرياض, 12564-9078, Saudi Arabia / السعودية"
394,55598f19498ee652727c6f31,"شارع أبي هريرة, النسيم الشرقي, Al Naseem District Eastحي النسيم الشرقي, Al Naseem Municipality, النسيم, منطقة الرياض, 11426, Saudi Arabia / السعودية"
395,5071cc10e4b0559b4e01b22a,"الملك عبدالله, القدس, Al Qouds District حي القدس, الرياض, منطقة الرياض, 13216, Saudi Arabia / السعودية"
396,56ba30cd498e8546c990cc05,"الأمير بندر بن عبدالعزيز, Al Nahdhah District حي النهضة, الرياض, منطقة الرياض, 13211, Saudi Arabia / السعودية"
397,4bb05bd4f964a5206b423ce3,"الأمين عبدالله العلي النعيم, الملز, Al Malaz District حي الملز, الرياض, منطقة الرياض, 12836, Saudi Arabia / السعودية"
398,506a9744e4b05499f5d3309d,"خالد ابن الوليد, Ghirnatah District حي غرناطة, الرياض, منطقة الرياض, 13244, Saudi Arabia / السعودية"
399,55c66703498ef932c075117a,"الطريق الدائري الجنوبي الفرعي, As Suwaydi al Gharbi District حي السويدي الغربي, العريجاء, منطقة الرياض, 12783-8458, Saudi Arabia / السعودية"
400,55d23251498e99e0b5458c02,"أبي جعفر المنصور, اليرموك, الرياض, منطقة الرياض, 62800, Saudi Arabia / السعودية"
401,56d34f02cd101bd7e4202140,"Steak Escape, Al-Hussain Bin Ali, Al Izdihar District حي الازدهار, الرياض, منطقة الرياض, 13241, Saudi Arabia / السعودية"
402,55119182498e3e51b76de06a,"خالد ابن الوليد, Al Andalus District حي الاندلس, الرياض, منطقة الرياض, 13211, Saudi Arabia / السعودية"
403,53d6cccc498e02947a2f0c1a,"طريق الأمير محمد بن سعد بن عبدالعزيز, Al Malga District حي الملقا, Stadtbezirk asch-Schamāl, الدرعية, منطقة الرياض, 13522, Saudi Arabia / السعودية"
404,5e02986aac88ee0008b3115f,"Al Rimal District حي الرمال, الرياض, منطقة الرياض, Saudi Arabia / السعودية"
405,4e6a07aad164c37bf4623bdd,"McDonald's, طريق الملك عبدالله, Al Raid District حي الرائد, الدرعية, منطقة الرياض, 12371, Saudi Arabia / السعودية"
406,4efef727490182a1a6d3887b,"Prince Sara Bint Alemam Abdullah, Al Khuzama District حي الخزامى, الدرعية, منطقة الرياض, 12393 4057, Saudi Arabia / السعودية"
407,4be6c9d6cf200f4716da143c,"McDonald's, طريق الملك عبدالله, Al Nuzhah District حي النزهة, الرياض, منطقة الرياض, 12483, Saudi Arabia / السعودية"
408,5648b2c8498ec6f3a4d62743,"بني مسعود, Al Rabiea District حي الربيع, Stadtbezirk asch-Schamāl, الدرعية, منطقة الرياض, 7069, Saudi Arabia / السعودية"
409,4e738a8cb993272e5236e274,"Mc Donald's, خالد ابن الوليد, Ghirnatah District حي غرناطة, الرياض, منطقة الرياض, 13216, Saudi Arabia / السعودية"
