,id,address
817,5ed21056946d44000858fa25,"العثيم مول, ابن نصر, الربوة, Al Rabwah District حي الربوة, الرياض, منطقة الرياض, 12883, Saudi Arabia / السعودية"
818,5ca3360bf709c100397964ea,"Panorama Mall, Al Sahqour, Al-Ma'athar Al-Shimali District حي المعذر الشمالي, Municipality Al Madhar المعذر, منطقة الرياض, 12334-2723, Saudi Arabia / السعودية"
819,5e04644993cebf0008912551,"Atyaf Mall, الإمام عبد الله بن سعود بن عبد العزيز, Al-Qadisiyah District حي القادسية, الرياض, منطقة الرياض, 62800, Saudi Arabia / السعودية"
820,5e21dbd2df80e90008d2d0c0,"القصر مول, السويدي العام, منفوحة الجديدة, As-Suwaidi District حي السويدي, الرياض, منطقة الرياض, 19678, Saudi Arabia / السعودية"
821,5ccd84bbf00a70002cbf06bb,"Lulu Hypermarket, شارع الفجر, Al Yasmin District, Stadtbezirk asch-Schamāl, الرياض, منطقة الرياض, 7069, Saudi Arabia / السعودية"
822,5dc3e253b76cb70008b41cdb,"PSU Female Campus, Running Track, صلاح الدين, Salah ad Din District حي صلاح الدين, الرياض, منطقة الرياض, 12435, Saudi Arabia / السعودية"
823,59d7be345d891b5884122c13,"الطريق الدائري الشمالي, Al Aqeeq District حي العقيق, Stadtbezirk asch-Schamāl, الدرعية, منطقة الرياض, 12393 4057, Saudi Arabia / السعودية"
824,4fb53a6be4b0a0f95a2e91ce,"Panorama Mall, Al Sahqour, Al-Ma'athar Al-Shimali District حي المعذر الشمالي, Municipality Al Madhar المعذر, منطقة الرياض, 12334-2723, Saudi Arabia / السعودية"
825,58ed15384ca49b1405407660,"ابن صدر, Al Nuzhah District حي النزهة, الرياض, منطقة الرياض, 12471, Saudi Arabia / السعودية"
826,56056dc7498eb0f060fd2b96,"النخيل مول, طريق الإمام سعود بن عبد العزيز بن محمد, مغرزات, Al-Mugharzat District حي المغرزات, الرياض, منطقة الرياض, 12483, Saudi Arabia / السعودية"
827,57e823bd498e0aaf3aceaca9,"وادي المشقر, Al Olaya District حي العليا, Municipality Al Madhar المعذر, منطقة الرياض, 12213, Saudi Arabia / السعودية"
828,4fa64462e4b0217538ad0996,"مركز غرناطة, شهيد الدين ثم الوطن علي أحمد الزهراني, Ghirnatah District حي غرناطة, الرياض, منطقة الرياض, 13241, Saudi Arabia / السعودية"
829,5146e804e4b088752118740d,"Forum & Computer Center, road_12, King Saud University District, الدرعية, منطقة الرياض, 145111, Saudi Arabia / السعودية"
830,50c8542ae4b0d1a95fe77ac3,"الملز, Al Malaz District حي الملز, الرياض, منطقة الرياض, 12631, Saudi Arabia / السعودية"
831,5b53975993bd63002c1d8906,"Riyadh Park, الصياد, Al Aqeeq District حي العقيق, Stadtbezirk asch-Schamāl, الدرعية, منطقة الرياض, 12388, Saudi Arabia / السعودية"
832,58fb25a0d7627e4dd3d6b3f8,"محمد النباهي, Al Falah District حي الفلاح, Stadtbezirk asch-Schamāl, الرياض, منطقة الرياض, 13314 - 4017, Saudi Arabia / السعودية"
833,5a7b487725fb7b6cc4e25450,"الدائري الشمالي, Al Ghadir District حي الغدير, Stadtbezirk asch-Schamāl, الدرعية, منطقة الرياض, 11552, Saudi Arabia / السعودية"
834,51fd7fc8498ebd46bbe9ec4a,"Turki Al Awal Ibin Abdelaziz Road, Hittin District حي حطين, Stadtbezirk asch-Schamāl, الدرعية, منطقة الرياض, 12393 4057, Saudi Arabia / السعودية"
835,54b03047498e10f090f0a666,"Qurtubah, الرياض, منطقة الرياض, 13244, Saudi Arabia / السعودية"
836,567a7250498e37140c462167,"شارع أنس بن مالك, الياسمين, Al Yasmin District, Stadtbezirk asch-Schamāl, الرياض, منطقة الرياض, 7069, Saudi Arabia / السعودية"
837,5e08a4b983cd69000722fd42,"Riyadh Front Shopping, Airport Road, Qurtubah, الرياض, منطقة الرياض, 13314 - 4017, Saudi Arabia / السعودية"
838,585628e8da54ae2d25a01191,"طريق الأمير مشعل بن عبد العزيز, عرقة, الدرعية, منطقة الرياض, 11614, Saudi Arabia / السعودية"
839,531e16bd498efd001f4e1e60,"الملك عبدالعزيز, Al Ghadir District حي الغدير, Stadtbezirk asch-Schamāl, الدرعية, منطقة الرياض, 13311, Saudi Arabia / السعودية"
840,5819076912d23675fda3791a,"الدمام, Ghirnatah District حي غرناطة, الرياض, منطقة الرياض, 13244, Saudi Arabia / السعودية"
841,53f5bebe498ecc0a7965d904,"Al Olaya District حي العليا, الرياض, منطقة الرياض, 12213, Saudi Arabia / السعودية"
842,584184f9de0cbc1db7790111,"طريق الملك فهد, Al Aqeeq District حي العقيق, Stadtbezirk asch-Schamāl, الدرعية, منطقة الرياض, 13515 - 4372, Saudi Arabia / السعودية"
843,56674603498e5d488012bab0,"هبة الله السامري, Al Olaya District حي العليا, Municipality Al Madhar المعذر, منطقة الرياض, 12213, Saudi Arabia / السعودية"
844,509bf7dee4b00d566f8b193e,"الخاتلة, District حي ام الحمام الشرقي, Municipality Al Madhar المعذر, منطقة الرياض, 12211, Saudi Arabia / السعودية"
845,50ebff3ce4b085f050cd4a65,"Al Raid District حي الرائد, الدرعية, منطقة الرياض, 12371, Saudi Arabia / السعودية"
846,4ff750cfe4b045d12e3b133b,"الإمام أحمد بن حنبل, Al Naseem District West حي النسيم الغربي, Al Naseem Municipality, النسيم, منطقة الرياض, 11433, Saudi Arabia / السعودية"
847,4c01291ccf3aa5935b88ccb0,"البرود, صلاح الدين, Salah ad Din District حي صلاح الدين, الرياض, منطقة الرياض, 12435, Saudi Arabia / السعودية"
848,595a25fc35d3fc2a96333008,"Al Faisaliah Mall, رقم 36, Al Olaya District حي العليا, الرياض, منطقة الرياض, 12211, Saudi Arabia / السعودية"
849,5ab18be0d552c73bc456a6c4,"Riyadh Park, الصياد, Al Aqeeq District حي العقيق, Stadtbezirk asch-Schamāl, الدرعية, منطقة الرياض, 12388, Saudi Arabia / السعودية"
850,59046610a423622127fb1669,"King Abdul Aziz Road, Al Rabiea District حي الربيع, Stadtbezirk asch-Schamāl, الدرعية, منطقة الرياض, 7069, Saudi Arabia / السعودية"
851,5388ecb6498e279098d99f28,"Al Uarayja al Gharbiyah District حي العريجاء الغربية, العريجاء, منطقة الرياض, Saudi Arabia / السعودية"
852,58d7d9c092ca4c5b4f843659,"مكة المكرمة, Al Olaya District حي العليا, Municipality Al Madhar المعذر, منطقة الرياض, 12211, Saudi Arabia / السعودية"
853,56f518e6498e0c68f1c6eb7a,"شارع سعيد بن عبدالله السيد, Hittin District حي حطين, Stadtbezirk asch-Schamāl, الدرعية, منطقة الرياض, 13514 - 7741, Saudi Arabia / السعودية"
854,568dbdf2498e6b03d0289860,"محمد بن مهيزع, Hittin District حي حطين, Stadtbezirk asch-Schamāl, الدرعية, منطقة الرياض, 12393 4057, Saudi Arabia / السعودية"
855,5c9d0e36a22db7002c6695be,"Al Masif District حي المصيف, الدرعية, منطقة الرياض, 13311, Saudi Arabia / السعودية"
856,5d336ffe898bc70008b4a987,"Em Sherif Cafe, The zone, طريق التخصصي, المحمدية, Al Muhammadiyah District حي المحمدية, الدرعية, منطقة الرياض, 12364, Saudi Arabia / السعودية"
857,5c2079f618d43b002c06e8ba,"Navi Saudi, Tahliya Street, Al Olaya District حي العليا, الرياض, منطقة الرياض, 12213, Saudi Arabia / السعودية"
858,4f0c86d2e4b0baf830f4628e,"الملك فيصل, King Faisal District حي الملك فيصل, الرياض, منطقة الرياض, 13216, Saudi Arabia / السعودية"
859,4e41bd8218a8627fce3e4bb9,"Mc Donald's, خالد ابن الوليد, Ghirnatah District حي غرناطة, الرياض, منطقة الرياض, 13216, Saudi Arabia / السعودية"
860,4edfae7829c25233b60632a8,"Ash Shifa District حي الشفا, Al Shifa Municipality, الرياض, منطقة الرياض, 14713, Saudi Arabia / السعودية"
861,5a9bdac6da5e5656bc21fa50,"Quiznos Sub, تركي الأول بن عبد العزيز آل سعود, حي النخيل, Al Nakheel District حي النخيل, Stadtbezirk asch-Schamāl, الدرعية, منطقة الرياض, 12393 4057, Saudi Arabia / السعودية"
862,4e91de0b30f81ec6000305c0,"الملك عبدالعزيز, Al Masif District حي المصيف, الدرعية, منطقة الرياض, 13311, Saudi Arabia / السعودية"
863,507c645ce4b0697bf5706cf4,"طريق الملك فهد, Al Aqeeq District حي العقيق, Stadtbezirk asch-Schamāl, الدرعية, منطقة الرياض, 13515 - 4372, Saudi Arabia / السعودية"
864,5467a1cd498e62d4c6ac119d,"الملك عبدالعزيز, Al Ghadir District حي الغدير, Stadtbezirk asch-Schamāl, الدرعية, منطقة الرياض, 13311, Saudi Arabia / السعودية"
865,4f3f840ae4b08b2471eb419a,"أم الحمام, District حي ام الحمام الشرقي, الرياض, منطقة الرياض, 12334-2723, Saudi Arabia / السعودية"
866,4cb15c2e75ebb60cfbd3ccad,"صفينة, Al Washam District حي الوشام, الرياض, منطقة الرياض, 12631, Saudi Arabia / السعودية"
867,5a930880fe3740171f68c404,"Gloria Jean's Coffee, شارع أنس بن مالك, Al Malga District حي الملقا, Stadtbezirk asch-Schamāl, الدرعية, منطقة الرياض, 13522, Saudi Arabia / السعودية"
868,50338ca2e4b0412b1014a962,"طريق المدينة المنورة, Zahrat al Badiah District ظهرة البديعة, Namar Municipality, العريجاء, منطقة الرياض, 12783-8458, Saudi Arabia / السعودية"
869,5914d3dcd69ed00d25f3c4ad,"وادي الساحل, Al Rimal District حي الرمال, الرياض, منطقة الرياض, 7428, Saudi Arabia / السعودية"
870,54678216498e2e08a232a6ff,"الأمير محمد بن عبدالعزيز, Al-Ma'athar Al-Shimali District حي المعذر الشمالي, Municipality Al Madhar المعذر, منطقة الرياض, 12213, Saudi Arabia / السعودية"
871,566743a5498e06aab98f2a61,"وادي المشقر, Al Olaya District حي العليا, Municipality Al Madhar المعذر, منطقة الرياض, 12213, Saudi Arabia / السعودية"
872,5709ed56498e150639cbbd93,"Al Nada District حي الندى, Stadtbezirk asch-Schamāl, الرياض, منطقة الرياض, 13314 - 4017, Saudi Arabia / السعودية"
873,5825dc90e9e6fe0327ba5620,"المحمدية, Al Muhammadiyah District حي المحمدية, الدرعية, منطقة الرياض, 12364, Saudi Arabia / السعودية"
874,58eb9555e0adac258f576f98,"أبي سعيد الخدري, الملك فيصل, King Faisal District حي الملك فيصل, الرياض, منطقة الرياض, 62800, Saudi Arabia / السعودية"
875,56674327498e323a856eeb83,"وادي المشقر, Al Olaya District حي العليا, Municipality Al Madhar المعذر, منطقة الرياض, 12213, Saudi Arabia / السعودية"
876,50f43419e4b0462a6c8e3bf4,"الجديدة, الدرعية, منطقة الرياض, 13514 - 7741, Saudi Arabia / السعودية"
877,52fc994f498ec066f9764bfb,"Al Amir Sultan Ibn Abdul Aziz, Al Olaya District حي العليا, الرياض, منطقة الرياض, 12211, Saudi Arabia / السعودية"
878,56622102498e7d1d090d1d97,"وادي المشقر, Al Olaya District حي العليا, Municipality Al Madhar المعذر, منطقة الرياض, 12213, Saudi Arabia / السعودية"
879,5dfdff0f3913a80007a8f48e,"طريق عثمان بن عفان, Al Nargis District حي النرجس, Stadtbezirk asch-Schamāl, الرياض, منطقة الرياض, 13314 - 4017, Saudi Arabia / السعودية"
880,5790a03f498e651432a0e66a,"شارع القنا, الياسمين, Al Yasmin District, Stadtbezirk asch-Schamāl, الرياض, منطقة الرياض, 11543, Saudi Arabia / السعودية"
881,57e3add8498e2474f594fb89,"طريق الصحابة, Al Ishbiliyah District حي اشبيلية, الرياض, منطقة الرياض, 62800, Saudi Arabia / السعودية"
882,5c36e56b51950e002c3e1793,"طريق المدينة المنورة, Salam District حي سلام, الرياض, منطقة الرياض, 11131, Saudi Arabia / السعودية"
883,57f76d21498e66b4452b8640,"الامام الشافعي, Al Fayha District حي الفيحاء, As Sali Municipality, الرياض, منطقة الرياض, 11433, Saudi Arabia / السعودية"
884,59a7133959fe5c0af14e6d79,"الأمير عبدالرحمن بن عبدالعزيز, المربع, Al Murabba District حي المربع, الرياض, منطقة الرياض, 11526, Saudi Arabia / السعودية"
885,54a44440498e87a65d8e12ec,"الأمير منصور بن عبدالعزيز, الوزارات, Al Wizarat District حي الوزارات, الرياض, منطقة الرياض, 11422, Saudi Arabia / السعودية"
886,59c3993aa9fe124f49ec896c,"الأعشى, حي السكيرينه, الرياض, منطقة الرياض, 11131, Saudi Arabia / السعودية"
887,5da6f03fa48672000717e927,"الأمير نواف بن عبدالعزيز, District of Umm Al-Hamam (West) حي ام الحمام الغربي, الرياض, منطقة الرياض, 11321, Saudi Arabia / السعودية"
888,56544fdc498ecdb84efc1277,"وادي حنيفة, Al Olaya District حي العليا, الرياض, منطقة الرياض, 12213, Saudi Arabia / السعودية"
889,575d833c498e51d08ddf9fa4,"لولو هايبر ماركت, الامير فيصل بن تركي بن عبد العزيز, المربع, Al Murabba District حي المربع, الرياض, منطقة الرياض, 12631, Saudi Arabia / السعودية"
890,5e5ea37103634e00088efa4f,"آل شويعر, الملز, Al Malaz District حي الملز, الرياض, منطقة الرياض, 12836, Saudi Arabia / السعودية"
891,54245388498e8e9b84d8f651,"خالد ابن الوليد, Ghirnatah District حي غرناطة, الرياض, منطقة الرياض, 13244, Saudi Arabia / السعودية"
892,5908682928374e0476048e17,"طريق أبي بكر الصديق, النرجس, بنبان, منطقة الرياض, 11543, Saudi Arabia / السعودية"
893,56c20a9ccd10c0f8ff53adb2,"الشيخ حسن بن حسين بن علي, الحمراء, الرياض, منطقة الرياض, 62800, Saudi Arabia / السعودية"
894,57c6ee1b498ead1bf95aeed7,"ابن مقلة, Qurtubah, الرياض, منطقة الرياض, 13244, Saudi Arabia / السعودية"
895,5548f0ef498e836279e61f3b,"عبدالله بن سليمان الحمدان, السلامة, As Sulaymaniyah District حي السليمانية, الرياض, منطقة الرياض, 11525, Saudi Arabia / السعودية"
896,542d8f6f498e2182c16befa1,"king fahad-alworod, طريق الملك عبدالله, الملك فهد, King Fahd District حي الملك فهد, الرياض, منطقة الرياض, 12272, Saudi Arabia / السعودية"
897,58d5814b02b60e44cc8ca4f4,"طريق الأمير محمد بن سلمان بن عبدالعزيز, Qurtubah, الرياض, منطقة الرياض, 13314 - 4017, Saudi Arabia / السعودية"
898,5635a691498e155daa5794a8,"2, حي الجزيرة, Al Jazirah District حي الجزيرة, As Sali Municipality, الرياض, منطقة الرياض, 11211, Saudi Arabia / السعودية"
899,5345714b498e2ea01385d0c8,"الحلة, As Salihiyah District حي الصالحية, الرياض, منطقة الرياض, ١١٤٩١, Saudi Arabia / السعودية"
900,5673c1ed498e87c83553160f,"الأمير منصور بن عبدالعزيز, الوزارات, Al Wizarat District حي الوزارات, الرياض, منطقة الرياض, 11422, Saudi Arabia / السعودية"
901,5c9e62e595d986002c80ce6a,"شارع القادسية, الياسمين, Al Yasmin District, Stadtbezirk asch-Schamāl, الرياض, منطقة الرياض, 7069, Saudi Arabia / السعودية"
902,5702c0e1498e32425717a330,"رقم 288, المونسية, الرياض, منطقة الرياض, 11263, Saudi Arabia / السعودية"
903,5e2b157c965a8a0007107060,"Islam abad road, Al Mansurah District حي المنصوره, الرياض, منطقة الرياض, 54033, Saudi Arabia / السعودية"
904,58b0943919b1ad5493470187,"طريق هارون الرشيد, Al Nour District حي النور, As Sali Municipality, الرياض, منطقة الرياض, 11211, Saudi Arabia / السعودية"
905,59eaef5c95a7222dabd8149f,"بديع الزمان الهمذاني, Al Zahrah District حي الزهرة, الرياض, منطقة الرياض, 12783-8458, Saudi Arabia / السعودية"
906,5bd22d2846e1b6002c9ee17d,"طريق ديراب, District, Al Shifa Municipality, الرياض, منطقة الرياض, 14713, Saudi Arabia / السعودية"
907,4e25379352b17b2b5dcc5461,"Al Raid District حي الرائد, الرياض, منطقة الرياض, 11321, Saudi Arabia / السعودية"
908,5e7208f046a4ad00082aa872,"لولو هايبر ماركت, الامير فيصل بن تركي بن عبد العزيز, المربع, Al Murabba District حي المربع, الرياض, منطقة الرياض, 12631, Saudi Arabia / السعودية"
909,4f3f87a8e4b0a5f251e36239,"Al Murabba District حي المربع, الرياض, منطقة الرياض, 11526, Saudi Arabia / السعودية"
910,58bf0109000bef1274a522ba,"شريمبلس, شارع أنس بن مالك, الياسمين, Al Yasmin District, Stadtbezirk asch-Schamāl, الدرعية, منطقة الرياض, 7069, Saudi Arabia / السعودية"
911,577052d4498ec3ff8fb116c0,"الأمير منصور بن عبدالعزيز, الوزارات, Al Wizarat District حي الوزارات, الرياض, منطقة الرياض, 11422, Saudi Arabia / السعودية"
912,52ecec17498eb4e8ba838cae,"منفوحة الجديدة, Manfuha Al-Jadidah District حي منفوحة الجديدة, الرياض, منطقة الرياض, 11131, Saudi Arabia / السعودية"
913,4c87ffd57223b1f792ff27a8,"رقم 76, Al Olaya District حي العليا, الرياض, منطقة الرياض, 12214, Saudi Arabia / السعودية"
914,4bc207bcf8219c747421b410,"Lahori Khabay, الأمير عبدالرحمن بن عبدالعزيز, الوزارات, Al Wizarat District حي الوزارات, الرياض, منطقة الرياض, 11526, Saudi Arabia / السعودية"
915,50a1524ce4b0f56d62944aed,"مطعم اللبنان الكبير, Pr. Mamdouh Bin Abdulaziz St., صلاح الدين, As Sulaymaniyah District حي السليمانية, الرياض, منطقة الرياض, 11411, Saudi Arabia / السعودية"
916,5360fe7d498eed0ebea2d1dd,"الأمير عبدالرحمن بن عبدالعزيز, الوزارات, Al Wizarat District حي الوزارات, الرياض, منطقة الرياض, 11526, Saudi Arabia / السعودية"
917,5373ad42498eb8ad81c79130,"ابن جلجل, Ash Shumaysi حي الشميسي, الرياض, منطقة الرياض, 11131, Saudi Arabia / السعودية"
918,4dac932da86e771ea750f558,"رقم 10, Olaya Computer Market, Al Olaya District حي العليا, الرياض, منطقة الرياض, 12211, Saudi Arabia / السعودية"
919,4d53c1eebbbf37040d383878,"ابن النديم, المربع, Al Murabba District حي المربع, الرياض, منطقة الرياض, 11526, Saudi Arabia / السعودية"
920,5c0a8713dab4b1002c2955f9,"فطور فارس, الأمير تركي بن عبدالعزيز الأول, District حي ام الحمام الشرقي, Municipality Al Madhar المعذر, منطقة الرياض, 12334-2723, Saudi Arabia / السعودية"
921,5c0a86fd81635b002cf0885a,"SABB, شارع التحلية, Al Olaya District حي العليا, الرياض, منطقة الرياض, 12213, Saudi Arabia / السعودية"
922,5dfce194227f9b0008cf0f8c,"مركز غرناطة, شهيد الدين ثم الوطن علي أحمد الزهراني, Ghirnatah District حي غرناطة, الرياض, منطقة الرياض, 13241, Saudi Arabia / السعودية"
923,5c0a8711bcbf7a00395ae735,"القلم, Hittin District حي حطين, Stadtbezirk asch-Schamāl, الدرعية, منطقة الرياض, 12393 4057, Saudi Arabia / السعودية"
924,566220b2498e897cbc594d0c,"وادي المشقر, Al Olaya District حي العليا, Municipality Al Madhar المعذر, منطقة الرياض, 12213, Saudi Arabia / السعودية"
925,5a99537fda5e5656bc1c646e,"فطور فارس, الأمير تركي بن عبدالعزيز الأول, District حي ام الحمام الشرقي, Municipality Al Madhar المعذر, منطقة الرياض, 12334-2723, Saudi Arabia / السعودية"
926,5b97c076e17910002cee9fba,"الأمير تركي بن عبدالعزيز الأول, King Saud University District, الدرعية, منطقة الرياض, 145111, Saudi Arabia / السعودية"
927,58ce361015fb433bd0a3fd3c,"Al Olaya District حي العليا, الرياض, منطقة الرياض, 12213, Saudi Arabia / السعودية"
928,56b0f8a5498e22d232fcdeba,"الطريق الدائري الشمالي, Al Aqeeq District حي العقيق, Stadtbezirk asch-Schamāl, الدرعية, منطقة الرياض, 12393 4057, Saudi Arabia / السعودية"
929,5bcf1206894eac0039adaf87,"Al Masif District حي المصيف, الرياض, منطقة الرياض, 13311, Saudi Arabia / السعودية"
930,5c29e562f62e09002c047f63,"الملك عبدالله, الحمراء, الرياض, منطقة الرياض, 13216, Saudi Arabia / السعودية"
931,52e3d584498e4eb9ba2ca33d,"شارع الحكم المستنصر بالله, حي الخليج, الرياض, منطقة الرياض, 62800, Saudi Arabia / السعودية"
932,5be71312610f04002cf5d0df,"الأمير عبدالعزيز بن مساعد بن جلوي, المربع, Al Murabba District حي المربع, الرياض, منطقة الرياض, 11422, Saudi Arabia / السعودية"
933,5b51dff195d986002ce4d108,"وادي الساحل, Al Rimal District حي الرمال, الرياض, منطقة الرياض, 7428, Saudi Arabia / السعودية"
934,5c04f61e515d6a0025600209,"خريص, District حي النظيم, Al Naseem Municipality, الرياض, منطقة الرياض, 11426, Saudi Arabia / السعودية"
935,5a5aee67da5e564531bb9f1a,"Ibn Hazan, Al Uarayja al Gharbiyah District حي العريجاء الغربية, Namar Municipality, العريجاء, منطقة الرياض, 12564-9078, Saudi Arabia / السعودية"
936,5b99f15d3731ee0039b1430f,"Riyadh Airports Company (RAC), 539, الرياض, منطقة الرياض, Saudi Arabia / السعودية"
937,5c98c0829cadd9002c774081,"الأمير محمد بن عبدالعزيز, Al-Ma'athar Al-Shimali District حي المعذر الشمالي, Municipality Al Madhar المعذر, منطقة الرياض, 12213, Saudi Arabia / السعودية"
938,5d571db1c0e1a400080d67e6,"طريق الأمير محمد بن سعد بن عبدالعزيز, Al Malga District حي الملقا, Stadtbezirk asch-Schamāl, الدرعية, منطقة الرياض, 13522, Saudi Arabia / السعودية"
939,5d3dc6be5c2b8900077fc541,"طريق الأمير محمد بن سعد بن عبدالعزيز, Al Malga District حي الملقا, Stadtbezirk asch-Schamāl, الدرعية, منطقة الرياض, 13522, Saudi Arabia / السعودية"
940,5ae7d0e8d4cc98002cdfdf05,"Abdullah Al Baihaqe, المحمدية, Al Muhammadiyah District حي المحمدية, الدرعية, منطقة الرياض, 12364, Saudi Arabia / السعودية"
941,5cd341b23c858d002caf4277,"الإمام سعود بن عبدالعزيز بن محمد, Almuruj District حي المروج, الدرعية, منطقة الرياض, 12273, Saudi Arabia / السعودية"
942,5d081d1f3fcee8002c658580,"U Walk, 4545, الملك خالد, King Saud University District, الدرعية, منطقة الرياض, 12393 4057, Saudi Arabia / السعودية"
943,5b6334a046e1b6002cb95fbe,"King Abdul Aziz Road, الياسمين, Al Yasmin District, Stadtbezirk asch-Schamāl, الدرعية, منطقة الرياض, 7069, Saudi Arabia / السعودية"
944,5cb0909ce706550025d2371c,"الإمام عبد الله بن سعود بن عبد العزيز, Al-Qadisiyah District حي القادسية, الرياض, منطقة الرياض, 62800, Saudi Arabia / السعودية"
945,5c7a989b5315930039e72d0c,"Al Nada District حي الندى, Stadtbezirk asch-Schamāl, الرياض, منطقة الرياض, 13314 - 4017, Saudi Arabia / السعودية"
946,5b3ce816b3d8e2002c660071,"الواحة, Al Waha District حي الواحة, الرياض, منطقة الرياض, 12483, Saudi Arabia / السعودية"
947,5bcb73bf03132000390f1703,"Al Malga District حي الملقا, Stadtbezirk asch-Schamāl, الدرعية, منطقة الرياض, 13522, Saudi Arabia / السعودية"
948,58c34239f229950961c38270,"مطعم مشاغيث, طريق الأمير محمد بن سلمان بن عبدالعزيز, Qurtubah, الرياض, منطقة الرياض, 13314 - 4017, Saudi Arabia / السعودية"
949,5d03edf1f05ca8002dcc5010,"Khalifa Bin Badae, المحمدية, Al Muhammadiyah District حي المحمدية, الدرعية, منطقة الرياض, 12364, Saudi Arabia / السعودية"
